{
  "artifact_paths": [
    "work/final_result.json",
    "work/evidence_matrix.json",
    "work/validation_report.json"
  ],
  "compacted": false,
  "context_usage_percent": 35.0,
  "created_at": 1784620799.9344604,
  "estimation_method": "reported_tokens",
  "retained_state": {
    "applicable_policies": [
      "01_expense_reimbursement_2025.md",
      "03_authorization_management.md"
    ],
    "artifact_index": [
      "work/audit_plan.json",
      "work/evidence_matrix.json",
      "work/final_result.json",
      "work/validation_report.json"
    ],
    "audit_plan": {
      "steps_completed": [
        "data_query",
        "policy_query",
        "investigation",
        "false_positive_review",
        "report",
        "validation"
      ]
    },
    "complexity": 3,
    "constraints": {
      "7_day_window": true,
      "duplicate_rule": "第十条",
      "higher_threshold_AR02": 3000,
      "split_rule": "第十一条"
    },
    "evidence_status": "matrix_pass_100pct",
    "findings": {
      "conclusion": "无异常",
      "duplicate": "发票不同不触发",
      "split": "500<3000不触发"
    },
    "record_ids": [
      "R004234",
      "R004235"
    ],
    "remaining_budget": {
      "submission_remaining": true
    },
    "subagent_used": false,
    "submission_status": "not_submitted",
    "task": "核查R004234和R004235是否构成重复报销或拆分报销",
    "task_id": "TRAP-002",
    "unresolved_items": [],
    "validation": "valid_true"
  },
  "stage": "validation_ready",
  "task_id": "TRAP-002"
}
