{
  "artifact_paths": [
    "work/audit_plan.json",
    "work/evidence_matrix.json",
    "work/final_result.json",
    "work/validation_report.json"
  ],
  "compacted": false,
  "context_usage_percent": 55.0,
  "created_at": 1784209501.0107415,
  "estimation_method": "reported_tokens",
  "retained_state": {
    "anomaly_ids": [
      "AR-02_MISSING_FINANCIAL_REVIEW"
    ],
    "applicable_policies": [
      "01_expense_reimbursement_2025.md",
      "03_authorization_management.md"
    ],
    "artifact_index": {
      "audit_plan": "work/audit_plan.json",
      "evidence_matrix": "work/evidence_matrix.json",
      "final_result": "work/final_result.json",
      "validation_report": "work/validation_report.json"
    },
    "audit_plan": {
      "cross_reference_found": true,
      "tiers_identified": [
        "AR-01",
        "AR-02",
        "AR-03",
        "AR-04",
        "AR-05"
      ]
    },
    "constraints": {
      "complexity": 3,
      "two_hop": true
    },
    "evidence_status": {
      "complete": true,
      "coverage_100_pct": true
    },
    "record_ids": [
      "R004233",
      "R004207"
    ],
    "remaining_budget": "sufficient",
    "submission_status": "accepted",
    "task": "L3-007 two_hop_retrieval 交叉引用审批档位",
    "task_id": "L3-007",
    "unresolved_items": []
  },
  "stage": "submission_ready",
  "task_id": "L3-007"
}
