{
  "artifact_paths": [
    "work/audit_plan.json",
    "work/final_result.json",
    "work/evidence_matrix.json",
    "work/validation_report.json",
    "work/report_draft.json"
  ],
  "compacted": false,
  "context_usage_percent": 20.0,
  "created_at": 1784189254.108551,
  "estimation_method": "reported_tokens",
  "retained_state": {
    "applicable_policies": [
      "05_training_expense.md"
    ],
    "artifact_index": [
      "work/audit_plan.json",
      "work/final_result.json",
      "work/evidence_matrix.json",
      "work/validation_report.json",
      "work/report_draft.json"
    ],
    "audit_plan": {
      "subagent": false
    },
    "complexity": 0,
    "constraints": {
      "complexity": 0,
      "no_anomaly": true,
      "single_rule": true
    },
    "evidence_status": {
      "evidence_coverage": "pass_100pct",
      "validation": "valid_true"
    },
    "record_ids": [],
    "remaining_budget": "sufficient",
    "submission_status": "ready",
    "task": "现行培训制度中，内部培训和外部培训的综合费用每日上限分别是多少？",
    "task_id": "DEV-002",
    "unresolved_items": []
  },
  "stage": "validation_ready",
  "task_id": "DEV-002"
}
