{
  "artifact_paths": [
    "work/scripted_workflow.json",
    "work/task_memory.json",
    "work/final_result.json",
    "work/evidence_input.json",
    "work/evidence_matrix.json",
    "work/validation_report.json"
  ],
  "compacted": false,
  "context_usage_percent": 0.0,
  "created_at": 1784649408.7947083,
  "estimation_method": "external_scripted_stage",
  "retained_state": {
    "applicable_policies": [
      "01_expense_reimbursement_2025.md",
      "03_authorization_management.md"
    ],
    "artifact_index": [
      "work/scripted_workflow.json",
      "work/task_memory.json",
      "work/final_result.json",
      "work/evidence_input.json",
      "work/evidence_matrix.json",
      "work/validation_report.json"
    ],
    "audit_plan": {
      "category": "policy_data_comparison",
      "reason": "A focused record-to-rule comparison does not need the full workflow.",
      "route": "focused_record_audit",
      "skills": [
        "batch-expense-analysis"
      ],
      "subagent_is_mandatory": false,
      "subagent_role": null,
      "workflow_version": "scripted-enhancement-v1.2"
    },
    "constraints": [
      "single isolated task",
      "read-only policy corpus and expense database",
      "no evaluation answers or historical trajectories"
    ],
    "evidence_status": "pass",
    "record_ids": [
      "R004212",
      "R004213"
    ],
    "remaining_budget": {
      "managed_by": "outer_runner"
    },
    "submission_status": "not_submitted",
    "task": "结合制度和业务数据，核查以R004212为线索的拆分报销异常，返回发现ID和record_id集合，并说明日期窗口、合计金额和制度依据。",
    "unresolved_items": []
  },
  "stage": "submission_ready",
  "task_id": "L2-008"
}
