{
  "artifact_paths": [
    "final_submission.json",
    "submission_receipt.json",
    "traces/context_events.jsonl",
    "traces/events.jsonl",
    "traces/subagents.jsonl",
    "traces/tool_calls.jsonl",
    "work/artifact_index.json",
    "work/context_checkpoint.json",
    "work/decision_log.jsonl",
    "work/evidence_index.json",
    "work/evidence_matrix.json",
    "work/final_result.json",
    "work/task_state.json",
    "work/validation_report.json"
  ],
  "compacted": false,
  "context_usage_percent": 0.0,
  "created_at": 1784202476.0430999,
  "estimation_method": "outer_runner_finalization",
  "retained_state": {
    "applicable_policies": [
      "01_expense_reimbursement_2025.md",
      "03_authorization_management.md"
    ],
    "artifact_index": [
      "final_submission.json",
      "submission_receipt.json",
      "traces/context_events.jsonl",
      "traces/events.jsonl",
      "traces/subagents.jsonl",
      "traces/tool_calls.jsonl",
      "work/artifact_index.json",
      "work/context_checkpoint.json",
      "work/decision_log.jsonl",
      "work/evidence_index.json",
      "work/evidence_matrix.json",
      "work/final_result.json",
      "work/task_state.json",
      "work/validation_report.json"
    ],
    "audit_plan": "outer_runner_finalization",
    "constraints": [
      "isolated GATE3 workspace",
      "formal answer assets prohibited",
      "outer runner timeout enforced"
    ],
    "evidence_status": "pass",
    "record_ids": [
      "R900010",
      "R900011"
    ],
    "remaining_budget": {
      "elapsed_seconds": 188.115,
      "remaining_seconds": 711.885,
      "timeout_seconds": 900
    },
    "submission_status": "accepted",
    "task": "你正在执行 GATE3 独立开发题，当前为领域增强组，不是正式评测题。\n\n任务ID：DEV-010\n题型：clean_trap\n问题：R900010与R900011合计超过10000元，请核查是否构成7天内拆分报销，并准确处理日期边界。\n领域增强路由提示：complexity=1; compact date-boundary review in main context; no native subagent\n\n必须遵循已安装的证券费用审计 Skills；先规划并记录Checkpoint，再按触发条件调查、复核、校验并通过统一工具提交。若复杂度至少为2且存在符合路由规则的角色，必须调用authorize_audit_subagent授权原生子智能体，并在原生角色结束后调用complete_audit_subagent登记摘要和产物；主上下文只接收六字段结构化摘要。\n\n要求：\n1. 必须查询制度和只读开发业务库后作答，可以使用 Shell、Python、SQLite和临时文件。\n2. 只处理当前独立工作区。禁止读取 ground_truth、正式 evals、判卷代码、历史答案、其他任务或候选轨迹。\n3. anomaly_ids 是审计发现标识，使用非空且内部一致的字符串即可；开发题判定以业务结论、record_ids和制度证据为主。\n4. record_ids必须遵守统一语义：有异常时只包含参与当前题目所问违规的记录，不含累计计算背景、有效豁免或无关规则记录；无异常时仍保留题目直接核查或结论覆盖的记录，并在answer中明确写“无异常”。\n5. 工作区的work/final_result.json、work/evidence_matrix.json和work/validation_report.json已经按共享Schema预置字段骨架；必须先把最终答案写入final_result.json，只更新字段值和必要的evidence_rows，不得改名、删除必填字段或另建替代格式。如需核对，只读取workspace/runtime-schemas下三个明确的*.schema.json文件；不要猜测其他路径或文件名。\n6. 调用audit_control.validate_audit_result时使用result_path=\"work/final_result.json\"及两个默认报告路径；取得valid=true后，以相同result_path调用audit_control.submit_audit_result。不要把完整结果对象嵌套在工具参数中。不得用终端直接import控制代码，也不得把最终JSON打印出来代替提交。\n7. 提交成功后最终只输出 GATE3_TASK_PASS；无法提交时只输出 GATE3_TASK_FAIL。\n",
    "unresolved_items": []
  },
  "stage": "submission_ready",
  "task_id": "DEV-010"
}
